{
  "$schema": "https://cips.cardano.org/cips/cipXXXX/schemas/assurance.json",
  "preamble": {
    "title": "Guessing game assurance",
    "description": "Generated claims about the compiled guessing-game rule.",
    "version": "1.0.0",
    "authors": [
      "Plutus contributors"
    ],
    "created": "2026-09-29",
    "license": "Apache-2.0"
  },
  "blueprint": {
    "uri": "ual-game-blueprint.json",
    "hash": {
      "alg": "sha256",
      "digest": "402d3a6d66db19c1f5390753edf80d06610af3ca494abdee835e8cd8fba1fc07"
    }
  },
  "languages": {
    "ual": {
      "name": "Universal Annotation Language",
      "description": "Property specification language used by Blaster.",
      "version": "0.5",
      "uri": "https://github.com/input-output-hk/UniversalAnnotationLanguage"
    }
  },
  "formalFragments": [
    {
      "id": "Main",
      "language": "ual",
      "source": "def hashMatches (actual guess : ByteString) : Prop :=\n  actual = PlutusCore.Crypto.Hash.sha2_256 guess"
    }
  ],
  "properties": [
    {
      "id": "correct_guess",
      "scope": {
        "validators": [
          "gameValidator"
        ]
      },
      "statement": {
        "text": "A guess whose hash matches the datum terminates successfully for every context.",
        "formal": {
          "language": "ual",
          "uses": [
            "Main"
          ],
          "source": "∀ (actual guess : ByteString) (ctx : Data), hashMatches actual guess →\n      isSuccessful (gameValidator (Data.B actual) (Data.B guess) ctx)"
        }
      }
    },
    {
      "id": "wrong_guess",
      "scope": {
        "validators": [
          "gameValidator"
        ]
      },
      "statement": {
        "text": "A guess whose hash differs from the datum fails script evaluation for every context.",
        "formal": {
          "language": "ual",
          "uses": [
            "Main"
          ],
          "source": "∀ (actual guess : ByteString) (ctx : Data), ¬ hashMatches actual guess →\n      isUnsuccessful (gameValidator (Data.B actual) (Data.B guess) ctx)"
        }
      }
    },
    {
      "id": "malformed_datum",
      "scope": {
        "validators": [
          "gameValidator"
        ]
      },
      "statement": {
        "text": "An integer datum fails to decode as the stored hash, for every redeemer and context.",
        "formal": {
          "language": "ual",
          "uses": [
            "Main"
          ],
          "source": "∀ (r ctx : Data), isUnsuccessful (gameValidator (Data.I 0) r ctx)"
        }
      }
    }
  ]
}
